text,labels
i asked starting to feel frantic,3
i admit that i ve been feeling discouraged and a bit beat down by life,0
i feel the pangs of wanting to say rude but truthful things like only the old people can do,1
ive been doing nothing but assignments and papers for class so im feeling a bit drained however i only have another few days to suffer because then everything is handed in i write my exams then head home for christmas,0
i am feeling very confident,2
i feel as if maybe i am unsure who i am spiritually,3
i often feel like im overwhelmingly homesick,0
im still feeling shaky and not always as strong as i want to be in this,3
i have the feeling too the excited feeling of having a baby girl in my belly,2
i feel especially lethargic or reluctant to exercise maybe a spoonful of peanut butter as self encouragement,0
i feel impatient and my cross irritates me jesus help me,1
im feeling really bouncy and hyper i cant wait to go home normally by the end of term i get so fed up of the same four walls that im dying to leave,2
i feel a little intimidated by the competition,3
i stay away from carbs nowadays gosh thank you for making me feel ugly oopa,0
i feel very blessed to work where i work,2
i could see j cutting the cord and i remember saying i was feeling very cold and felt like i was going to pass out,1
i simply rested but now i feel so agitated that im liable to say things i may regret,1
i have decided that instead of feeling like a bashful year old girl i will do something about it and get my fitness on,3
i experience heart burn from the last years now i experience that my neck and throat area gets tighten and feeling uncomfortable from the day before yesterday,3
i can feel my wounds aching my back is still throbbing,0
i feel superior to those around me making their thoughts and opinions obsolete,2
i hate that i feel so needy too,0
i received my asos dress yesterday i was supposed to feel happy about it but apparently i purchased the wrong size,2
i often feel irritated with clothes from the store the low quality fabric used and the fit sometimes the actual fabric is twisted,1
on my birthday i got a present that i had desired for a long time,2
i think the hardest part about our phd is probably that we pursue it at a time in our lives where we are old enough for really big things to happen to us and young enough to still feel unsure unbalanced inexperienced and afraid,3
i feel so relaxed when i am back,2
im modeling version of my nettie bodysuit changes here feel like its the perfect version for me,2
i feel bitter about suddenly working the chief cashier didnt tell me earlier,1
i am already feeling very paranoid and facebook is getting on my nerves,3
i feel like i am getting a creative part of me back which is very exciting,2
i feel so pained when anyone else complains about all the work they have to do,0
i did manage to have a good practice in spite of feeling agitated initially by where i was practicing in the room,3
i have a cold but i no longer feel overwhelmed and by the end of this week i should be very well rested,3
i feel frightened because i feel like i might fall down,3
im still feeling restless and discontented,3
i found that the recaps bogged down the story and left me feeling impatient to get on with things,1
i still love reading but i have to admit i have not missed the pressure to have a post up everyday or feeling pressured to read books i really was not that interested in,3
ive been making you feel pissed over the past few days too,1
i feel like i may be skeptical because even if he were to apologize would i accept it,3
i was once again feeling restless,3
i feel gloomy down and sorry,0
i woke up feeling disgusted feeling in vision coming in merging from the internal self physical feeling within,1
i don t know why he insists on torturing me but i want him next to me so badly that i push the feeling that this is all fake back far into my,0
i really don t feel like having a beloved memory tarnished and run ragged,2
i had been feeling a bit heartbroken that i lost all my contacts after my blackberry fried last week due to a shortage of memory,0
i was feeling really stressed out about my writing,0
i was thinking about that song and i was thinking about how some years feel harder than others to be thankful even though i know i still have so much to be thankful for,2
i apply for a job that i really really want and i don t get it then the next best thing is for another woman to get it and i feel infuriated when a dude gets it especially if i know we were equally qualified,1
i want to do in life i m not sure and this answer makes me feel as if i m not passionate about anything and will never live up to my potential can you hear the irrationality creeping in,2
im not sure how i feel about the finale yet but i sure did love this season,2
i could before the actual thing and then if i still couldn t figure out if i d feel embarrassed not knowing how to get in line or how to get a drink or where to park my car or whatever i just wouldn t go,0
ive been feeling rather bitter lately thinking about all the so called friends i used to have,1
i step off of my routine i find myself feeling out of sorts and irritable and jack and jill and humpty dumpty may start running through my head as i pull in deep breaths and try to clear my mind,1
i feel beaten,0
i feel that becuase of the tyranical nature of the government in el salvador and the savage social conditions of the general people that the set of thought to run the shoe shop in miguel marmols testimoney was able to work,1
i feel out of control i m going to be rejected or my life is changing,0
i dont know why but i end up feeling very needy lonely and confused,0
i have the feeling that teaching today isn t all that keen on memorization either,2
i have to get this off my chest and i feel like my blog is the perfect place to do so,2
i guess im feeling a little sentimental saying goodbye to this beloved camper,0
i don t love it you guys but sometimes when life feels weird you have to be careful what you share you know,3
i was feeling quite distraught as i didn t have my new nikon d to take the photo s then i checked my iphone to see if twitter had any news about the crash,3
i am feeling somehow superior because i dont hunt or because i have no interest in hunting i remember the gigantic swensons hawk who has been feeding daily on the baby coots congregating in families of twelve or thirteen in the slough,2
i get the same feeling of shaky fear when surfing on big days,3
i loved you and perhaps i love you still the flame perhaps is not yet extinguished yet it burns so quietly within my soul no longer should you feel distressed by it,3
i feel i felt awkward much because obviously it is not my birthday month,0
i want to say how important it is to talk to someone if you re feeling depressed or suicidal,0
i hear them i feel heartbroken regardless as well,0
i feel very agitated,3
i don t to make art i feel dangerous volatile ugly,1
i was feeling shaky which had started right when he was born but otherwise felt fine but i could feel blood pumping out of me and soaking the pads underneath me,3
i am feeling like as unimportant customer,0
i feel shy when girls gush over mesushant singh rajput august middot comments middot total views middot a href http www,3
i feel ugly i cover myself with a beautiful blanket in a make believe gown,0
i could have longed for more but not had to feel annoyed at the nice tidy fairy tale ending that felt completely false and useless,1
i feel so passionate about re using what we have as much as possible and creating less waste,2
i suppose you could say that lately ive been feeling stressed tired and anxious,1
i am wiped out and feeling mildly hostile to the idea of treating any patients in the near future,1
im kind of feeling it and want a picture to capture the wonderful moment of feeling anything but pregnant the camera likes to tell me otherwise,2
i feel rich in the people i know,2
i feel selfish giving her formula when i produce the perfect food for her already why give her something thats fake when i can give her the real deal myself,1
i love this one too when im feeling especially miserable mid workout when i want to stop,0
i often feel uncertain and unfulfilled because i rarely know whether i ve met anyone s needs by writing them,3
i am feeling hopeful especially on the toileting front,2
i cannot remember exactly such a situation but i know that once i went to a very dirty lavatory and that disgusted me,1
i feel that a hands on approach helps students understand that learning these topics don t have to be boring or monotonous they can be engaging interesting and entertaining when presented in interactive ways,0
i feel very frightened that i cant get thru this,3
i will probably do but for some reason i feel a bit agitated by it all,1
im sorry but please for societys sake stop feeling victimized,0
i know in my unemployment i wanted to start a business but i feel that i have little experience which leaves me disadvantaged,0
i feel restless can not concentrate,3
id never have to make another decision in my life that id regret that wouldnt pan out how id anticipated and left me feeling this troubled,0
i never want to get up because everything seems to feel as terrible as the night before,0
i like old buildings but i tend to feel peaceful,2
i really feel sorry for is those who do not claim to feel gods presence in the world,0
im really nt feeling gd abt sch tmrw uptight apprehensive,3
i was asked a lot of times if i feel offended by a photo of some random actress or model with a paper fan and i was like why,1
i think while you re having things done to you you feel less vulnerable but when medical attention stops you feel very much on your own,3
i feel like i can pretty much be as rude as i wanna be in order to get them to sit down shut it and learn their work,1
im feeling a lot less apprehensive about the showing other people my writing thing,3
i had been feeling suspicious all day,3
im still feeling indecisive about well a certain guy,3
i always feeling annoyed but him i dunno why and how do this feeling comes about but i just,1
i want and never feeling threatened in a serious way,3
i woke up feeling the beginnings of a cold so we made it a pajama day,1
when my wife died in hospital,0
i finally feel like my cold is letting up and that i actually might get to go a few days without taking cold medicine around the clock for the first time in months,1
i normally dislike those in ear buds because i feel they are uncomfortable and unhygienic,3
i feel so honored a class post count link href http gigglesandsqueals,2
im not biased and im not against womens liberation or womens rights however im against a woman who feels superior simply by the fact of not being a man i hate when a woman starts manipulating me and starts using me just because she was in the s ill treated,2
ive dealt with people who have i feel abused my friendship,0
i lay down i feel sad and purposeless,0
i get this feeling you shaken my existence,3
i feel very offended by this because i love my boyfriend so much,1
i walked out after talking to her feeling disgusted by all the lies,1
i try to capture it each time i feel disappointed,0
i feel so unsure of myself today i put on togs to go swimming and i felt awful i looked terrible and felt it i wasn t coming with the family to go swimming at all i knew i was letting everyone down but i felt so bad,3
i don t feel shaken by anything or anyone even during moments when i didn t feel in control,3
i feel she will come back to me times of india she had resolved to remain strong for the family but in pune her tears flow freely,2
i feel that im stubborn,1
i can think of that made me feel afraid was starting at a new school with all new people when i went to high school,3
im writing this i feel a tad bit reluctant to say goodbye to this year,3
i hope your not just now feeling remorseful for doing it,0
i visit the girls by the th grade window when im feeling unsure or hurt,3
i feel so confused recently for a few past weeks for exactly,3
i find it hard to talk to my partner on a visit and feel very distracted with what is going on around me,1
i amerikal hoca do you feel it how was it like that and now yes push harder waaaw amazing yes yes i feel it oh my god oooh amazing how strong it is falan eklinde konu uyolar,2
i find myself feeling the most inadequate when i am going over school stuff,0
i feel so overly blessed in this life,2
i have been trying to be more mindful and identify when i am feeling hostile to the present moment,1
i feel sorrow that my son has an addiction that is so dangerous and precarious,1
im feeling apprehensive about the king is dead,3
i thought it was cute that he was being so respectful not to feel me up but after this that last thing he needs to do is to play it cool,2
i feel like its such a selfish thought but im thinking it,1
i got bored from measuring my blood sugar sometimes it gets and i feel i am gonna die also i am paranoid now to go to the gym of getting low and faint infront of people any suggestions,3
i guess the game was feeling abused,0
i feel flippin fantastic,2
i feel like i m running in circles and i m terrified,3
i need the reminder that even when i feel frightened or defeated jesus holds me safe by his side,3
i have had half written it but did not feel entirely convinced about the content,2
i feel it has wronged me on so many occasions,1
i believe tells the story much better than the anime did which feels very rushed,1
i digest the lessons learned from the field trip ill admit that im not really feeling very joyful,2
ive been feeling pretty crappy about it but ive done a good job at blocked those feelings out,0
i feel like i can focus more and accomplish more while still having some free time,2
i took it i remember feeling extremely agitated,3
ive a feeling were going to have a lot of obnoxious children and a lot of cleaning up to do today because four out of the five films are and under,1
i feel like my life is the movie sweet home alabama,2
i feel like each experience teaches me a valuable lesson,2
i was feeling genuinely remorseful,0
i do feel really rotten for not have blogged anything in a long time,0
i feel very shitty because of the antibiotics im taking,0
i had been feeling low suffering from terrible pmd post marathon depression especially without being able to actually run it off,0
i just feel so annoyed with the way our economic job market is set up,1
i feel like my birthday goes by and im like ok whatever despite loving theatrics and attention and talking to people my birthday always feels weird,2
i also feel reassured that troy is carefully checking the work being done by the subbies,2
i listen to these clips i have the same feelings of joyful inspiration and great gratitude,2
i feel the brush from your nose as i lay there flawless in my sexy pose skin scented with victorian rose mind filled with the serenaded prose that has delivered me with no clothes head tilted you nibble on my neck i stop breathing just for that sec,2
i feel like his life was a wonderful illustration of what true faith is and the crowd s response to his high wire act serves as a valuable life lesson as well,2
i can definitely imagine how my students feel when i ask them to write and they just look at me with blank expressions on their faces,0
i was already feeling privileged to be holding the damn thing,2
i couldnt see but i could really feel and in between the distance theres a sorrowful heart that weeps everytime shes hearing his thoughts,0
im feeling all fucked up sad and depressed though with my friends hes enjoying himself with her and all,1
i remember feeling uncertain at first but now after working with it a bit i must say im in looove,3
im feeling indecisive and it scares me,3
i can feel smug,2
i feel i m at a position where i can go out there and not hurt myself that s when i ll be back out there,0
i feel ys even with that pretty face of yours how can you be dumber than a bear,2
i feel pretty intimidated and honored to be showing at a show with all of them,3
i have always paired my feeling of being strong with my physicality,2
i can assume they are not feeling the cold like i am their water is not frozen they have plenty of feed though they eschew this in favor of foraging and scratch,1
i go to sleep i feel as if i m giving up precious time to do something else with my life,2
i didint believe though that after many relationships no woman made me feel safe because in a way it was all merely a fling with each woman i had made love to,2
i love feeling frightened or despised as much as i love feeling safe or worshiped and because through writing i can feel every piece of those emotions whenever i want to,3
i feel i should be disturbed by this but in a way i find it quite liberating that i actually documented something most people would consider silly,0
i drifted off to sleep feeling intimidated about the big climbs i would face right away in the morning,3
i feel idiotic this semester even though my classes are fantastic,0
i feel so much sadness for our world today and am deeply distressed that people choose to actively push away the love of jesus christ ignore what is right in their hearts listen to our world and let our fallen society dictate how you stand on certain issues,3
i like exercising enough to feel ok not having to do much and basically never looking in mirrors and connecting with how i really look,2
i feel triumphant what comes to mind is the plane that was landed in the hudson all passengers safe a heroic crew,2
i thought when i walk into ibrahim id feel more homesick sense of longing to be there but no,0
i only got the information on line but im still going to borrow rest of the episodes and feel realistically tortured,1
first anatomy lesson,1
im feeling sort of sentimental get ready for a gratitude post,0
i feel frightened that i allowed that to happen,3
i was stoned and feeling sorry for myself and in the process of having a bitter argument with my soon to be ex girlfriend,0
i didnt lose him as ellie did her husband in this book but i have been in a hospital in the icu feeling shaken and wondering why me why him,3
im not even sure that i have them now but its just one of those nights where i feel burdened by my thoughts and need some sort of mental release,0
i feel brave to say what i really think inside my brain and seriously what i say is truth and from my deep heart,2
i was feeling calm and i was fine ciganda said,2
i prefer brevity the extended explanation of your situation has informed me enough to feel confident in my advice,2
i feel so vulnerable right now and it is taking all of my will power not to run,3
i feel so impatient right now i need a distraction,1
i feel drained and i hope the distance will make it better ya know,0
i never stayed in one pair of shoes long enough to feel like i broke them in,0
i sit there and listen to a conversation about it without feeling uncomfortable,3
im feeling rather festive at the moment so have adorned these glittery butter london shades,2
i wrote that entry about the river race and found myself feeling irritable all day long,1
i feel that im a foolish student in this earth,0
i feel the comfort i have been aching for i have been yearning for for so long and yet it wasnt until i laid there drifting into a light sleep in your arms for the first time that i realized how long i was actually yearning for them,0
i made her feel wimpy by riding that bike for miles and still keeping up with her,3
i feel on the brink of that delicious sense that something terribly profound witty or otherwise worthwhile to the world is about to gush from my cerebrum,2
i feel like i lost,0
i like the feeling of freedom as we sat dangerously on the unprotected seat,3
i feel pretty guilty about those times too,0
i think it did me some good because i m feeling anxious to get back to work,3
i feel like i ve been tortured for a week it s like i haven t slept despite my or hours of unconsciousness i feel hungry but i can t eat and i still can t walk in a straight line,1
i feel so awful all the time,0
when a close friend of mine who was with me in first year could not make it to the second year,0
i do yearn for those typically but when i do get close i feel uncomfortable,3
i reached in to carefully feel around if any of them were damaged,0
i may feel lost right now in my motherhood but the pressures i am facing are far less tragic than making a mistake of raising a king,0
i have to say that i feel pretty proud,2
i get when i start to feel complacent,2
i carry this life within me without feeling resentful and cross even though it is much longed for,1
i sort of understand that there is a point to this but i always hated summaries and i always will and i think im feeling very rebellious about this,1
at work being shifted to another area,1
i distinctly remember accompanying one of my girlfriends to the mall and feeling positively distressed that i couldnt just buy what i wanted when i wanted,3
i feel like i can pretty much out think anything that comes my way,2
i feel petty jealousy or anger yesterday in the face of my wifes happiness and our decision to chaperone a trip with my sons school,1
i woke to another dream of my lover this time more sexual in nature which hopefully means im feeling less insecure,3
i think for me i feel so aggravated some days by the misinformation and agendas from the big business and corporate greed that drive what happens to our food,1
i feel inadequate to possess these relics,0
i am essentially feeling out my colleagues to see who is most eager and open to working with me what goals are feasible and which needs are attainable,2
i know it s a really bad day when i feel myself going numb and into a sort of trance,0
i feel extremely privileged to have had the chance to interact with her on a personal level,2
i feel like i m getting greedy i want more for my websites but the thing is i can t,1
i hear a car honk and instead of feeling aggravated i just notice the sound and carry on,1
i always find that when i get myself back into reading i feel less stressed about life and happier in general if thats not a reason to pick up my kindle then i dont know what is,0
i love that he can one minute talk about something spiritual or some inner strength that fuels endurance but then admit to being horrible to one of the support team and feeling terribly remorseful,0
i thought that the guy i had been associating with for over a year went out or times with a high school girl whom he claimed not to like,1
i feel pretty wimpy,3
i start a project i feel a little guilty like i dont give my all to the kids so last night i had the kids come into the garage and talk to me play laugh,0
i feel one should not be considerate towards old people and be inconsiderate and throw then out,2
im feeling numb these days other than excited or depressed its hard to cry when youre emotionally numb wow,0
i feel like i might be somewhat talented,2
i just walked out of the house and kept walking down this dirt road in the dark wearing a dress feeling so hated and misunderstood,1
i feel more vulnerable these days,3
i am also human being obviously i do feel angry at times due to the others,1
i feel more free,2
im also wracked with the guilt that comes from white privilege and i know how many people would kill for a job any job and then i just feel like a horrible person altogether,0
i once held all of those beliefs so it s no wonder that a breakup meant feeling fearful sad devastated,3
i feel so vulnerable i need to have a mask on to go into the world or if my desire is caused by a need to divert attention or cover up weakness i should probably be making more constructive use of my time than trying to look pretty,3
i feel attacked because i think he s one of the most intelligent and level headed leaders that we have ever had,2
i feel less burdened in a way,0
i feel like he was threatened that i am after something,3
i featured you today feel free to add this button to your site add a link back to knick of time a href http,2
i mean obviously i feel alone my best friend and other half is dead,0
i look it i feel like its a bit cold in winter,1
i will readily admit that i am an emotional eater things get tough a bad thing happens or i m feeling low i turn to cake as my drug of choice,0
i feel relieved to have something to help keep my balance,2
i am well familiar with the gut wrenching feeling that accompanies being ignored and excluded from outings as well as the terrible sense of being alone in a crowd at a gathering of my fellow human beings,0
i have come to this small town only to have doors slammed in my face and be made to feel that i am strange and out of place,3
i would hop on to ride behind will feeling excitingly rebellious a cool mom already,1
i feel irritable and heavy headed,1
i have always loved reading the tea interviews on your wonderful blog and feel deeply honoured to have my words join those of others like yourself whose words and photos i admire so much,2
i feel like they ve accepted us as freshmen,2
i feel like ive been asleep all this time and ive finally been shaken awake,3
i feel like some divine source is telling me to be alone sexually,2
i also felt feel guilty for not being able to handle visitors as much as i wanted too,0
i feel like a fake calling him my husband although that is totally and completely what he is to me vice versa,0
i could feel his voice shaken a little bit,3
i can t found any adjectives what i feel i feel paranoid and i can t help but cry,3
i feel is cool sheet,2
i feel like the year was productive in most areas of my life,2
im feeling resolved because my budgeting plans are on track and i leave in seven weeks,2
i feel like my life is really shaky right now,3
