text,labels
i notice myself start to feel stressed or sad or angry or in love,1
i hate the idea that he d ever feel isolated by his allergies,0
i have a tiny rant i didn t like the feeling that nothing will make her happy unless she can marry as if marriage equals happiness,2
i was very scared when i went to the examination hall for my msc examination as i had studied a limited partion of the course thoroughly and i was in great doubt whether that would be asked,3
i walked away from that blessing feeling very peaceful but a little bit skeptical,2
i feel altogether comfortable with,2
i should be feeling the most invigorated and loved and content,2
i was feeling really distressed about qualifying,3
i don t know about you but when i feel wronged i can t breathe,1
i would feel insulted and disrespected,1
i feel so worthless in his eyes,0
i feel guilty and all but i just cant stop myself,0
people who discriminate other people disgust me,1
i feel it is really important for students to engage with people from different walks of life,2
i feel paranoid i feel paranoid posted by a href http www,3
i have to admit i feel resentful of being blame for imagined wrong done by this individual,1
i feel homesick for kansas and my friends family back there,0
i am planning to apply as a model after working at the caf but because of my breasts i feel like i would not be accepted there,2
i was feeling pretty shaky so i did a blood sugar check and called to see what to do,3
i am sharing today features the feeling sentimental stamp set and the sycamore street designer series paper,0
ive been able to figure out how she is positioned due to her hiccups feeling like they are very low and some sharp jabs that i get mainly in my right ribs that i think are from some very strong little legs,0
i know its silly but i still feel pissed off,1
i did manage two short runs and a walk but today im back to feeling just shy of awful,3
i feel like i wont be terribly heartbroken if we arent pregnant this cycle,0
i want to reach out to others who are also suffering but maybe i wont feel like im guarding a dangerous secret anymore,1
i wish i had some cloud patterned paper or pks cloud stamp i feel like it would have been the perfect background on the middle layer hmm,2
i feel simultaneously envious and angry when i read partisan squabbles on twitter,1
i finally got up to the counter i was as nice as i could be feeling extremely sorry for the agent who had just been berated,0
i feel hopeless and alone,0
i get of oz is the occassional viewings of home and away and even a bit of neighbours if im feeling really tragic,0
i am also feeling nervous,3
im feeling pretty mellow today,2
i remember walking aimlessly around the mall and various shops just to kill time but feeling bitter and empty,1
i kind of did that to myself today reading some old post and feeling weepy about my unknowing circumstances,0
i cant seem to shake off this weird feeling that i am hated and ignored by many people,1
i know more than one person whos been the victim of unintended contamination but lots of restaurants and even takeaways are getting it right and being a coeliac is feeling less and less like a weird form of first world boo hoo food martyrdom,3
i really dont know if ill ever learn it completely but i hope i at least always remind myself of it when im feeling impatient,1
i put an end to that and hold people accountable when i end up hurt or angry or when i feel wronged,1
i cant even talk to you about what i am feeling because all you do is get mad at me,1
i know how she d feel any hint of a comment especially one as unkind as that would be met with fury,1
i feel the cold stony surface underneath me,1
i have been feeling very weepy today i seem to burst into tears at everything even just thinking of how much i will miss my husband this year makes me break down today,0
i was feeling pretty lethargic perhaps it wouldve done me some good to soak in a hot tub with a bunch of strangers,0
i have this feeling like im really over caffeine this time but i dont want to get too complacent,2
im going to feel helpless and go pour some gatoraide and warm some chicken soup,3
i feel really idiotic im wishing i had a boyfriend i dont like to want that because it makes me feel desperate and needy just like every other single out there,0
i see others enjoy the freedom and i feel envious,1
i feel insulted and manipulated and though i have said no i feel like somehow this class will go on the other girls,1
i start to feel uncomfortable unsettled,3
i made in photoshop i feel a little less uptight,3
i got in it so im feeling too smug,2
i sometimes feel guilty giving bad reviews but we re not all going to like each other s body of work,0
i like i just feel really really shy every so often i d want to go up to her and compliment her but when i try i wind up blushing,3
i feel that if i am ever feeling ashamed or uncomfortable with dressing differently that i am just denying my calling from god,0
i dont agree with him i do feel hes sincere and acting in good faith and with great personal honesty,2
i am feeling but have not really dealt with or resolved,2
i do not want to leave anyone feeling judged or pressured into over extending themselves,3
i found myself out in nature feeling at peace and content with my life,2
i feel like i have to touch on things because i never want those who are about to have their tp ait to read things and get so scared that they decide not to follow through with surgery,3
i feel to insecure to go out to a restaurant,3
i feel really dull from years of suppression and repression and sometimes i catch myself tearing up at moments when im not supposed to and im not pregnant,0
i feel is tortured by the present hateful towards the future and rage for the past which i hold in regret,3
i can t sleep and i m feeling restless,3
i feel very selfish and immature in a lot of areas except with adam actually,1
i wanted to do was slide my window open and feel the cool night air on my face but i couldnt,2
im feeling a bit cranky today,1
i am feeling stubborn about using it because i had to give up the few names that i was in love with because he didnt like them,1
i not feel shy any more now is the end of my off day what i did today were cooked some food to feed myself eat and online and watch series all the time,3
i havent sleep properly in two days but im feeling romantically frustrated tonight,1
i feel so angry and lost as i have no idea where our relationship is headed,1
i didnt think this thought i would feel trusting in the flow open hearted,2
i feel more confident about investing in the obesity trend exposure to insulin makers hip and knee replacement equipment food trends fitness and so on or investing in european equity markets,2
i wonder how the angels feel about these examples of tragic bad luck,0
i wait for my hair to dry i feel even more like a princess for a day as my hubby prepares me my fav breakfast only for special occassions i think beauty day warrants this he makes me french toast and i love it,2
i also know that if i forget for a period of time it would cause tension or a feeling of unease that maybe i am mad at him,1
i feel it in the air class delicious title share this on del,2
i was feeling frustrated with a simple dress i decided to make for maggie that was not working out,1
i have a feeling i caught something from the vampire lestat who was more than a little friendly with me,2
i remember feeling so wronged by their restrictions on my life i felt that i knew better,1
i feel idiotic and wierd in this class,0
im feeling calm gentle reader,2
id already seen my doctor but i always feel that he labels me as neurotic and then just sends me away,3
i cant bring myself to hate you but i just cant help feeling disgusted,1
i feel like ive gone mad with wanting more pain or anger or both,1
i didnt know you had a kid i said feeling triumphant,2
i know all of that and believe me ive felt so guilty for feeling this way for so long and ive beaten myself up enough about it so you dont need to worry about letting me know all of that stuff,0
i have a feeling that it sounds more like all those people being so dissatisfied so at odds with themselves that they have to emit all that carbon in order to compensate for that discontent,1
i like the level of communication players are getting especially from ghostcrawler but i m getting the feeling that the expansion is being rushed out before it s actually ready,1
i can t pass by my office without checking email when i stay up until am following the results of the wisconsin supreme court election yes i really did that when i find myself feeling cranky because no one has retweeted that brilliant tweet of mine something is out of whack,1
i feel doubtful though,3
im still feeling pretty rotten and not sleeping,0
i was attending the class and feel a little bit nervous but as the time passed by i started to adapt and feel comfort in that position like this is not the st time,3
i try to blog happily all the time sometimes it just feels so fake because i know even though im not controlling it im not really that happy,0
ive been feeling a little emotional about adding you to our little family of three but i know that there are so many sweet moments waiting for us when you get here,0
i could feel him against me but far enough away that i was practically frantic with the need to be closer,3
i don t know i feel terrible for the past few days then boom i look like a condemned machine,0
i feel so distressed over the speech mark but i do,3
i can suddenly feel my limbs becoming numb and lifeless,0
i feel as if ive missed the change to live dependently,0
i feel theyre safe,2
i feel like i was put on this earth with only the abilities to do lame ass jobs,0
i feel insulted that they don t cater to us they cater to a general nameless people says chris harris a fan who had waited in line since a,1
i had no idea the antibiotics were going to make me feel so awful ive been sleeping and very little else since my last,0
i can feel carefree and not afraid of dark,2
i really did feel ok physically i was just mentally drained,2
i feel so tortured by it,3
im frustrated and feeling impatient ive just had a moment of very weird synchronicity and i wanted to journal and share it with you,1
i was clasping that to my bosom and feeling quite pleased with myself when my brother called me over,2
i was beginning to feel mournful,0
i start to think i feel so awful i try to stop and purposefully think im so loved by god or god will bring me through this etc,0
i feel hesitant to give a great score to a blatant pop band but at the end of day those dancing days have made one of the more enjoyable records of the year,3
i can put in a hour day without even looking up and no one will feel rejected hungry or lonely that i can see,0
i feel the love a project for sweet olivia,2
i feel really fed up with myself for being like this and it s just a vicious cycle,1
i have been struggling with feeling unsure about myself,3
i was feeling what would be the perfect response that they could give that would make me feel better,2
i recall our time together the more i feel like im hopeless without her,0
i feel like my brain cells have been given a violent shake up,1
i feel heartbroken for blake who desperately wants a baby sister,0
i have had this feeling was back in after trusting christ for my eternal destiny,2
i no talk now mama feeling shy,3
i would still feel insecure about my figure i would have said yep that sounds like me,3
i remember feeling angry with my parents for not letting me participate in halloween but i can now understand where they were coming from,1
i feel pretty disgusted by his amazing piano playing skills especially when he s sight reading something,1
i think there are only two people i feel completely comfortable with now,2
i don t feel like being in a fake rel,0
ive lost enough weight in the last few months that i didnt feel physically threatened by their tenuous integrity but just barely,3
i finally find is this we could live with turmoil and the anguish in everything and still we could feel contented and happy and compassionate,2
i feel like i belong and most of all i don t get that cranky feeling that takes over me and makes me get into imaginary arguments in my head or results in me deleting some people from my facebook,1
when my sister came home late one day and thus disobeyed my parents,1
i truly do hope this helps somebody else who knows someone currently battling with cancer and that its okay to feel inadequate or helpless and that there are many people out there like you back to the races,0
i was not the one feeling homesick and within a minute that feeling had completely vanished and we just stood and laughed,0
im sorry i may be feeling a bit sarcastic tonight,1
i should feel resentful about this is the part of the relationship where one find out just how close one can become with another person,1
ive been feeling restless lately a tickle in my soul a need to do,3
i myself sometimes find it difficult to talk about feelings of discomfort or discontent,0
i have begun to feel really burdened for the women in our slums particularly my mamas in kina,0
i think everyone comes to a point where they feel very vulnerable in falling in love and that s what i m talking about she explained,3
i feel pretty a href http www,2
i feel so apprehensive and hesitant to tell him about what is best for us,3
im angry that i didnt trust my own instincts when i started feeling uncertain,3
i felt numb cold to my roots and it wasn t the good feeling kind of cold,1
i feel drained and completely unstable,0
i don t just think cool i feel cool,2
i don t feel very trusting towards people either after what tracey did with the trust i put in her,2
i just a human as usual i will sad i will cry i will feel hopeless too,0
i feel overwhelming disheartened when secret places become not so secret,0
i feel will make you successful a class post count link href http mylifemythoughts,2
im left feeling really confused by this one,3
ive been home that for the first time on my life im honestly feeling homesick but i guess thats what happens when youve been away for so so long that friends start calling you dramatically everyday,0
i was feeling somewhat intimidated by the miles i had planned for today miles,3
i am looking forward to extending my long runs more it feels really good to get into that double digit territory and really know that you can handle the long distance,2
i should have brought my tripod but i was feeling kinda shy cos my workmates have no idea how passionate i am about photography,3
i opened my car door and shimmied out feeling that it was awfully rude to be sitting in my car while he was trying to talk with me,1
i could think of to say whether to address a problem or to express my feelings or to just talk nothing was acceptable,2
i feel the need but after watching this i have it again i am so envious of her,1
i feel the cold on my face when she yells mommy look this is how you do six and half with your fingers,1
i was feeling very inspired by one of the people i follow on a href http ohchloe,2
i feel safe when i am with you,2
i did not feel fabulous,2
i feel so fucked up in the head because i keep replaying that one moment,1
im not sure theres any worse feeling than being startled awake,3
i doubt many mothers feel reassured by the mama tried tattoo their sons get inked on their necks in the joint,2
i am attracted to a male that i feel weird and wrong,3
i made you feel like i hated you im sorry for anybody who has broken youre heart but that doesnt mean you have the right to go break other peoples hearts,1
i feel your cold hands over my skin i taste your lack of empathy driving me to madness lick my flaws tell me how much you want me as i see the lust within your caved in eye sockets and it somehow fuels my desires,1
ive made this decision and i feel a bit like i owe an explanation to my faithful readers who have become my internet friends,2
i feel when i see a violent world around where love happiness seem to be a thing of the past where present stands for ba,1
i find myself fairly often feeling as though im being punished by men for traversing invisible barriers with my vaguely antisocial behaviour sometimes i dream about it,0
i feel conflicted about spending this money when there are people suffering in the world in the usa when there s bad news all around us and my life is so wonderful and i am so happy and blessed,0
i didnt feel so uptight and nervous,3
i feel like i disappointed them again since we missed out on the race yesterday morning and then the movies today,0
i feel like i want to go out into the garden and scream and scream till it all goes away i am so frightened as to what jon is going to have to go through but if it works it will be worth it,3
i would feel week a shaky in the past,3
i feel the author respected and prolific author,2
i had a really hard time initially feeling brave enough to speak to people,2
i feel that there is no hope no solutions no end to all this suffering,0
i guess i know how she feels very apprehensive about all the noise going on around us right now,3
i feel tortured i always undress halfway,3
i believe i am feeling reluctant to play anymore,3
i started to feel like two of my toes were rubbing together weird but the next aid station was a mile away,3
i worked for an alternative school and was crushed by the stress and the feeling that i wasnt doing enough to support my family or enough to impact the troubled students that i was trying to serve,0
i feel like you get so aggravated with it,1
i sat there feeling unwelcome like people kept expecting me to say something obnoxious but i had no intention of saying anything and in any case i remained silent and just sat there marveling at the decrepitude and lunacy around me,0
im frustrated that i feel so shitty and unmotivated every,0
i wished that i lose all my feelings sometimes i just want to be heartless feel nothing,1
i feel to be an uncomfortable relationship that black professionals have with the homeless,3
i feel like those whiney teenagers in stupid american chick flicks,0
im feeling happy again,2
i had moments of feeling overwhelmed and spent a few sleepless nights with my mind racing over details of decorations programs wedding favors a church reception and an rsvp list of people,3
im still feeling hopeful,2
i know that i have helped the teens i work with feel like they are a more valued part of the community but i also know that i fell short on planning and implementing programs that teach them what could be invaluable lessons if it could help them handle future situations more positively,2
i have been in the emotional space of the people i want to work with i know their pain and i feel their suffering,0
i am pursuing a career in the helping field i feel that it is important to take the techniques we learn and use them on myself,2
i got out and received a bill i would feel guilty about being weak and needing the help and spending money that could go to much more useful things if i couldve just stuck it out on my own,0
i jus kept quiet for a while she will feel like im angry or jealous and will hold my hand tight even i force open she will nv let go,1
i feel it is important to get my grade to go up,2
i can come to describing what it feels like to create something perhaps to someone who does not regularly create or who might be unsure of the whole creative process,3
i am feeling so doubtful that this kind of retreat is gonna be useful for me anyway,3
i can t shake the feeling of being fundamentally dissatisfied with my selection in the democratic primaries,1
i am feeling resentful it is my choice and i can choose to do things differently next time or even change my choice now,1
i know we create our own destiny but do you ever feel resentful for the way your life turned out,1
i was feeling a bit shy and anxious too,3
i am feeling thankful for that,2
i got him first and im feeling most smug about that o,2
i don t particularly feel joyful with this type of expense the cost for brand new tires was around bucks and the cost for used tires was around bucks and the state was left to be desired,2
i feel is disgust and hate because the inconsistency drives me mad so mad that i have been able to rip off this blinding guise and see what people are really made of,1
when i was jumped by three men in a deserted area,3
i have to let go of the feeling that if i drop the ball they are doomed for a life of sucky human being ism,0
i do not feel this crowd will do much for me and i would naturally be afraid to approach them at the risk of getting hurt,3
i just had that unsettled feeling you get when you have a fever and you are restless and want to move but dont because youre so incredibly exhausted to begin with,3
i feel terrified because my landlord has not changed our locks yet,3
i feel a lot heartbroken,0
i know jack would be thrilled to speak so don t feel hesitant about inviting him,3
i still am feeling quite distressed i snagged a meme xd,3
i can still hear the low murmur of their voices as my sisters and i sat apart from our parents frightened and feeling alone in this mausoleum of dead souls,0
i just feel defeated,0
i could feel the pressure to discipline and i have to be creative,2
i feel a little bit strange using the vending machines in the mckay education building i feel awkward wearing jeans in the rb fitness and i feel like my backpack is a little bit to big my stride a little bit too long and my scarf not quite fashionable enough in the hfac music,3
i could feel their skeptical smiles,3
i guess we both in our own ways find it hard to feel useful,2
i got so tired of it i got up in the middle of the night feeling so fearful and anxious and i sang my little heart out,3
i start feeling hopeless about dating i remind myself that i like myself,0
im trying my best to stop myself from having such strong feelings for him because that will be too dangerous,1
i was doing and i told him all about how i was feeling out of control and didnt like it and was afraid that i would never get back on track and i probably gained pounds in a week,3
i am home from work struggling to move air in and out of my lungs and honestly feeling kind of bitter,1
im not sure if i feel reassured or not,2
ive just finished the fourth book feeling satisfied knowing that im now as good as the others on the knowledge of the stories and more importantly i feel energised,2
i feel a perverse need to make you scroll anyway,0
i am fulfilled unlike so many other times when i feel empty instead,0
i deboarded the plane feeling relieved,2
i have realized the way i feel about anything is determined by none other than yours truly,2
i can t believe all the newborns that i ve photographed with heads full of dark hair but i am feeling just a little envious because my babies are bald and blonde as they come,1
i feel relaxed while listening to it i can study my own talk like that as well and that talk is interesting so i also laugh while cooking,2
i feel vulnerable saying this for fear of being judged by other vegans,3
i see this very clearly with children and animals but find it equally true for all living beings we all like to know what s expected and to feel useful,2
i still feel like i have wronged,1
i am too rigid and opinionated others feel i am way too indecisive,3
i am absolutely thrilled to see them for the third time feeling quite honored to do so,2
i also feel like im doing it to show him or maybe show myself that i can be an asset i can be useful and trustworthy and can lead,2
i feel like ive been really bitchy lately but i suppose ill get over it,1
i mean the one thing you never want to do is make a girl feel ugly and uncomfortable with herself because not only is it going to make her nervous about having to compete and look out for other people but its going to ruin anything that you want to be going with her,0
i feel a bit hesitant posting this rather snapshot ish picture after the technically brilliant and artistic portraits which have been posted here lately but here you go an oldie,3
i feel quite paranoid too worrying that i m being watched that everybody hates me etc etc,3
im pushed around i feel resentful and angry and thats why i yell,1
i feel as if im being blamed as well,0
i do not have a hobby and i do not feel too keen on spending money i do not have i ve done alot of that lately and it has caught up with me in a big way,2
i feel is smart enough to know that an encounter with such a sadistic person would lead to something bad,2
i cannot help but feel very disappointed,0
i feel petty and pretentious,1
i feel shaky and sometimes a little surreal but better,3
i turned the knob of my grannys two band radio and did not hear any broadcast,3
i mean i cant help but feel like we are all in this together from the successes to what make us vulnerable insecure and scared to the growing pains misunderstandings confessions redemption clarification and celebrations we are becoming and can be everything we say we a href http arehttps sites,3
i can feel that awkward pinching and need to tug on the fabric of my swimwear just thinking about it,0
i remember feeling so blank and empty,0
i feel like ive become petty and jealous over the summer,1
i did feel more charming haha,2
i have been going through the exact same feelings about my troubled teen and this holiday,0
i feel insulted by what youve said to me,1
i sign up for these challenges always when i m in an up cycle and feeling optimistic about my abilities and hope time and time again that i ll finally be able to complete this one,2
i feel so uncertain and shook,3
i feel a lot of passion and melancholy about my culture and how lonely i feel in this country that now feels like home,0
i feel so apprehensive of this new mindset,3
