text,labels
i feel really displays wans artistic style,2
i feel tremendously devastated you re always there shine on,0
im just feeling rather hostile of late,1
i have the keen sense that i as a human am programmed in some way to constantly seek situations that feel pleasant,2
i feel quite doubtful,3
i was excited about this process before but knowing you can participate in the new look and feel of sme and i m ecstatic,2
i am not a fan of dancing and it feels awkward,0
i have a feeling theyll get the win here even if im not convinced theyll actually avoid the drop whether they pick up three points or not,2
i started feeling shaky and nervous and directly on tomorrow i spiraled down and everything from yesteryear came out the plane crash my brother in law the first homicide i ever saw as a rookie,3
i feel threatened watched under suspicion,3
i am starting to feel isolated and worn out and grumpy,0
i finally got back in the air and i feel fantastic for having done so,2
i feel so helpless knowing they have things to do in the next couple of weeks that i could be home helping them do,3
i feel low i feel guilty,0
i feel horrible for even feeling or thinking why now of course its now,0
i want to hear won t open up and let me know about or look at his or her world makes me feel unsure about them,3
im feeling defeated but what else is new,0
i shall soon start feeling smug,2
i cant help but feel disappointed to consider the possibility that if the transfer didnt work our match could be over that quickly,0
i can feel the history life of lively people and identity of the city,2
i feel like people are afraid to open showrooms to only look in clothes,3
i also got the feeling that the clerks may have been skeptical about the amount on the gift card,3
im feeling a little paranoid sue me,3
im sure that is what got us through the first few days of pain exhaustion and feeling helpless and discouraged,3
i simply took a leaf from burlington bears book turned off the mobile phone stepped back from social networking and now am feeling incredibly relaxed,2
i feel vulnerable to the world even,3
i feel so innocent and happy,2
im tired of feeling lethargic and achy all the time,0
i feel so in my element and am learning a lot of valuable information,2
my joy knew no bounds when i was selected for a job even before having finished my studies,2
i began to notice that i was feeling scared,3
i could view today as the fitting coda to a week that found me feeling unhappy,0
i do go out i need to stop feeling guilty that im not in my box doing homework then get x more stressed out once i get home,0
i began a nutritional re balancing cleanse and after days i lost pounds and feel fabulous,2
i feel like i am not worth it like if i am boring to be with and with me not having a car than yes i feel like i am boring because i cant even do anything,0
im not sure collection etats poetiques is the work of peter philips as it feels a bit confused and rather uncoordinated,3
im feeling terrible and cant function,0
i know he feels he is often rejected or overlooked but if i could look like anyone it would be trent,0
i feel vain and selfish for suggesting it,0
i feel afraid to eat and rather being hungry,3
i havent decided how long it will go but im feeling absolutely amazing right now,2
i have to admit i dont get claustrophobic but i was feeling rather apprehensive about how i was going to react once down there,3
i was home alone feeling pretty low,0
i could have loved you i murmured inaudibly as i watched him go and then returned indoors feeling grumpy and yes lonely,1
i am feeling slightly groggy as fell asleep last night sat up in bed and my glass of wine is still there omg what a waste,0
i feel boring at my workplace,0
i felt and then to plunge to use a dramatic term into this morass i don t want to project my emotional experience onto him and be angry at him because i m having the experience in my body of feeling angry,1
i learn someone is pregnant i either pity her because she could have a mc like me or i feel bitter towards her because she can have children when i can t and i always resent her for reminding me of my pain,1
im starting to feel nervous about it now,3
i guess im feeling playful,2
ive had business with her and both times ive come away feeling glad to be an american,2
i feel like im being rude telling a friend that i cant listen to their problems all the time but guess what im dealing with problems of my own so hopefully they will just understand,1
i feel overwhelmed by work walden the portfolio which i will end up having a stroke nervous breakdown or a heart attack due to the portfolio which i am honestly having nightmares over the loss of a dear family member and life in general,3
i wasn t going to talk publicly about the pregnancy until after the first trimester but now that my entire life feels so uncertain and painful i had to get it out,3
i start to feel something my life takes its tragic undertone and subtely slips me a new one and makes it worse,0
i feel someone who was as terrified as she should ve been would ve been a little more humble,3
i feel that rejection makes you appreciate things more it makes you a stronger person and it makes you more determined than ever to reach for your dream job,2
i feel it i smile my precious baby is getting big and strong enough to connect with me i find it amazing,2
i just feel so dissatisfied with myself these days,1
i can t help feeling envious that they don t seem to struggle with the same issues of self esteem that we women do,1
i hated that so much because i didn t understand what you wanted us to do for it and also i don t like hearing myself talk on video it is just something i have never been okay with so i didn t feel comfortable with,2
i put family first and i feel helpless,3
i get that facebook is a business but this makes me feel uncomfortable,3
i have realized from this past week is that it is ok to feel heartbroken,0
i feel like im always nervous about something new,3
id feel a bit rude going outside and getting lost in chores out there,1
i feel a bit like the dignified ole oakie slightly bent sometimes world weary but still standing,2
when my friend girl promised to help me go to the hospital and be examined by good experts and she deceived me,1
i was scared of what my ring removal meant scared of how i was feeling and pissed,1
i feel worthless and cry myself to sleep,0
i don t know maybe it s my materialistic little self rearing its ugly head but i ve found that i can very easily feel dissatisfied with what i have at this time of year,1
i had the folks use stem sentences to trigger thoughts and sensory poems with lines like happiness feels like happiness sounds like fill in the blank,0
i dont know how he did it as i dont grandstand i just know im always right also about the fact that your owners make you sometimes wear panties i feel your pain and i think thats a pretty vicious thing of them to do,1
i feel like a woman is supposed to be respected at all times,2
i don t know how she can feel this way that s very woeful for me,0
i dont want her to beg at my feet but a how are you courtney or a hows your new project coming courtney would give me some affirmation that i dont feel like a submissive slug,0
i always feel stupid answering the questions and i can t ever think of anything clever to say so each time i end up repeating myself,0
i stay up and feel foolish,0
i feel like a greedy girl,1
i really gotta ingrain this in my mind the next time i start to feel all grumpy amp moody,1
ill love it and feel so virtuous ill do it forever or at least when there isnt sushi around,2
i have a feeling that my terrified states are stemming from just swallowing all the bullshit,3
i feel so very sorrowful that i should have done them so wrong after their faithful service,0
i have had this space in blogland and my page on facebook looming and i have been feeling neglectful,0
i feel overwhelmed depressed and horrified but generally the equanimity of the web mood reigns,3
i feel its important to bridge the gap between the a href http blog,2
i feel so lame even typing these,0
i still feel i shrugged again hesitant to say the word,3
i feel like a runner add to delicious a href http www,2
i hate and i feel and i love and i am tortured,1
i feel sorry for you and yes your mother should die cos she cancelled plans maybe cos her work is probably much less important than your frivolous plans,0
i am feeling anxious yet excited for this coming surgery on th november,3
ill even come out of it as one of those people who can have a small piece of dark chocolate here and there and feel completely satisfied when its gone,2
i didn t receive a response for my messages sent to you i feel heartbroken,0
i was feeling muscle aches headache listless and confused,0
i feel completely empty detached and depressed,0
i feel unhappy almost everyday and im so glad i finally get to feel the real happiness again and i hope this is for good,0
i feel resentful i am giving too much,1
i spend a dollar on ice cream but if i feel like giving to charity so i can feel virtuous ethics may lead me to choose to feed starving humans rather than re home kittens,2
i feel disgusted in any man in power who talks about electricity being a problem in his area and says even my own house has similar problems,1
i think im feeling shy but that makes zero sense,3
despite my being affectionate,1
i just don t know how to act this feeling is reluctant damn near,3
i still feel shaky but it is gradually getting better i have no idea what is going on,3
i said after the sum of all these small obstacles and minor frustrations even having people throw soft fruit at me when i got there would still feel vindicating and triumphant,2
i have a well staffed office or a relatively less busy schedule things run more smoothly and i feel less stressed,1
i don t feel perfect but i feel much better than i did at assen and that is very good,2
i just tend to feel timid about going to clubs,3
i feel it still the need to be violent and smash everything and hit everyone within my reach,1
i feel like i am vacationing in miami and sitting poolside with a strawberry daquiri and a handsome cabana boy,2
i feel kind of petty but i cant help it i dont have that in common with them and id rather talk about something else but they dont seem to do that,1
i went to see this guy at trailfinders he was nice enough but he made me feel quite disheartened at my ambitious list of places to travel in a year and didnt offer me any alternatives to the limited to month round the world flight ticket,0
i have to start over because i m beginning to suspect that life is better with other people around maybe even people you can t stand and since i can t get rid of a lingering feeling that the world is still dangerous i need another out,1
i was feeling pissed off as she grabbed me before she left and asked if i wanted to talk about it,1
i am now sharing my feelings once again through a blog entry may be an idiotic move but this is the way i can express myself fully,0
i feel that i have been cranky and annoyed especially when i get very tired in the evenings,1
i feel that it is finally starting to cool down a little bit here in jarabacoa,2
i feel angered at the thought that the bible is being treated with as much respect as a terrorist bomb making manual,1
i can say with certainty that minutes after you finish eating you will be full and satisfied and you will also feel fantastic,2
i always feel like we need to keep the workers entertained,2
i am feeling determined to do that,2
i feel sort of greedy for saying this i don t think a marriage that s recognized by only a handful of states and doesn t grant any federal rights of marriage is enough for me,1
i write this leslie is finishing last minute packing the kids are at a park with my parents leslies parents are doing odd jobs around the home and im feeling a bit shaky from my last double tall mocha from starbucks mixed with the emotions of leaving,3
i might have been trying to prevent myself from feeling heartless,1
im feeling impatient and my smile isnt going to last long,1
i feel envious of people living those intense relationships but having been married for years and together for years before that ive seen all those intense relationships fail,1
i feel calm and centered when i m working with the bees,2
i can promise that his outward gender expression did not lead him to feel threatened when walking up a dark path alone,3
i stood there watching them die feeling helpless,3
i struggled to not feel angry and go back to sleep her alarm started ringing in minute intervals from when i had to wake up,1
i finished work at am on saturday got home and teased the other half how i was right she was wrong and i fancied roast beef with roast potatoes and the full trimmings i was feeling quite smug with myself,2
i had no idea that so many women i knew had experienced what left me feeling so isolated and alone,0
im starting to feel comfortable,2
i have no links to any of the passengers crew or those involved in the operation but am already feeling frustrated and very much saddened by this unprecendented situation,1
i just keep finding myself feeling incredibly overwhelmed,3
im feeling pretty dangerous atm d ohoh,1
i can vaguely remember a time when i was sharp but now i just feel dull,0
i feel like i m paranoid but then again you never know,3
i am not really fond of the rain the humidity the cloudy sky i would dare say that i feel slightly depressed,0
i have wished her the best and i truly feel as though i am sincere about this,2
i sat there as our singer sang a song for them and then their stories were read i found myself crying thinking how they all must feel i remember that feeling myself of being part way to goal and so unsure if i would get to where i wanted to be,3
i cant help but get the feeling that its all been in vain,0
i said in the circle i really do feel accepted and part of the community here even though i maybe haven t integrated myself that well in actuality,2
i just feel kind of discouraged and guilty when i can only do like minutes on the treadmill and i m like what the hell this isn t going to do anything for me,0
i want is to feel pretty but feeling handsome is so much easier so i settle for that,2
im feeling less agitated,3
i feel like i havent started my job yet so im a little intimidated as is,3
i still have to deal with those feelings plus just dealing with my own weird thing i have going on,3
im no expert but i get the feeling thats really fucking dangerous,1
i feel unloved unappreciated and the ugliest of the ugly,0
i can tell you i have already worn it numerous times and even though the weather outside might be crap i feel fabulous in my pretty raincoat,2
being together with my best friend,2
i feel really dumb for reacting to the haircut with so much emotion its just hair after all,0
i feel the most emotional about the physical things packing up the baby sleepers reorganizing the bedrooms seeing the swings loaded up,0
i think of all my emotional how i feel so fucked up and broken,1
i played out this little game at a store even online i always left feeling a little triumphant as if i d beaten my spending habits into submission and was now replacing them with the new thrill of saving,2
i feel my pussy enraged with excitement brushing against my clit bringing me even further along the path of pleasure,1
i feel like this is the perfect location for me after the check in process we started to move into our apartment and make all the necessary target and wal mart runs,2
i use to listen to it a lot when i am feeling sad,0
i could feel the air go out of my girlfriends angry sails,1
i will feel the pain of what is commonly called friendly fire,2
i feel like ive been kind of lousy at my end of things but have been doing okay with my bible readings and devotionals,0
i feel so productive and happyyyyyy,2
i get a sense of emptiness when i stare at the moon but i also feel very content with that emptiness,2
i feel like im living in a community of very troubled adults who could care less about the children of carlsbad,0
i feel emarrassed about how vain i must be i look at him and think hes the most beautiful baby in the world,0
i thought of that i feel remorseful,0
i am feeling spiteful towards my party,1
i feel like a messy drawer hats been straightened up,0
i am not referring to a drunk dial where the caller feels less inhibited thanks in large part to a recipe for disaster that consists of one of each liquid cocaine kamikaze and a long island ice tea,3
i feel ashamed that i struggle so much to pay my bills,0
ill admit part of it is feeling rejected,0
i left with some very pretty bras and feeling pleased to know that they would actually fit right,2
i still feel very scared because the snake has not been caught she said,3
im feeling hurt,0
i feel very stubborn but it is a stubbornness born from experience,1
i love it and oils last for such a long time that i feel their price per use is low enough to justify the cost ahem,0
i feel this may have unfortunate implications in my own future sex life,0
i once again broken routine by staying up late and arising late so i m feeling rushed and b not only can i not think of anything about which i feel like writing but worst of all c i don t feel like writing at all,1
i feel so vulnerable when people can get into my head,3
when a boy had continued to use foul language and swearing in front of a group of my friends,1
i was feeling a bit stressed by the end hobbiton a href http www,1
i feel lousy when i eat them i guess part of me still wants to eat the way i used to eat for example i had tuna for lunch and wanted crackers with it,0
i am already feeling welcomed and embraced by this incredible community of professionals,2
i went to bed that night feeling as unsure as id ever felt about anything,3
i feel like a needy girlfriend always cramping his style,0
i find that theres a lot of problem with the current office politics and its making people feeling more and more unhappy working here,0
i just woke up and i m feeling divine and not as in young lady who gave hugh grant blow job for a fiver,2
im feeling sort of melancholy for another time in my life where i felt very free to say sorry,0
i had a feeling when i left that i just wasn t that relaxed enough to really do it justice,2
i kept it to myself rather than talking to morgan about it because i knew he would justifiably feel impatient and alienated from me since those running trips don t necessarily involve him and would take me away from our work together,1
i thought it was madness not to hire a driver too but graham did a great job of driving and not once did i feel at all nervous,3
im feeling oddly festive already,2
i just feel really pathetic for not going to the foot doctors sooner and it taking me stepping on a nail to realize to get healed,0
i just leave feeling frustrated,1
im feeling rebellious so i might get a tattoo,1
i often feel vulnerable and there is the other feeling that this beautiful man is under my skin,3
im so sick and tired of you you made me feel so happy in a certain day but mostly after a few days i am no longer happy,2
i filled the bottle and i must admit to feeling a little apprehensive as i opened the nozzle and raised it to my lips but again it was very nice clean tasting water albeit a little warm,3
i keep waiting for some grand stroke of wisdom and peace to overcome me but all i feel is irritable and bewildered,1
i feel distracted and irritable more so then usual,1
i feel a bit calmer but still distraught,3
i feel very vital notice a practice violin digital tuners don t respond precisely rapidly enough college students feel comfortable utilizing,2
i feel like today is a day to be thankful,2
i cant help but feel i would be doing my intelligent daughter a disservice by saying she should not be playing with such things,2
i do not begrudge those around me a festive thanksgiving but i feel as with so many holidays that the point is so lost in the hubbub,0
im feeling shitty right now because im not up in the black hills,0
i am feeling slightly less furious than i was half an hour ago,1
i will admit to sometimes feeling resentful,1
i hate feeling that way the way you have a lump in your throat the way you are afraid of talking because tears may keel over,3
i was feeling a bit empty when kyler and keaton left on saturday,0
i know you must have been feeling heartbroken when things didn t turn out the way you expected,0
im not really shaking then i must be losing my mind because to me it feels like its so violent,1
i feel disgusted at my cousin,1
im trying not to take the pills to see where things are at and when i discover its still there i feel defeated,0
i will adjust to it but for now it feels so strange,3
i know i am drawing off subject but i just feel so blessed to be able to see such a miraculous view such as a night sky,2
i suspect in some way each of us feels ugly incomplete abandoned rejected or damaged somehow or in some way,0
i always feel guilty when i have to call in and it doesnt matter how sick i am i feel like im doing something wrong,0
i had always thought myself to be quite unlucky infact i cant remember even feeling lucky or thankful for many events that did happen in my life,2
i feel like if i go it will be in vain but whats the point in living,0
i were feeling pretty stressed yesterday after leaving a meeting with president vila because we realized the load we d be carrying this next month as we fulfill our normal responsibilities as well as prepare for the departure of president vila and the arrival of president goates,1
i feel like a dirty hooker after going out drinking at my age i need it,0
i am not an advocate for war but i feel reassured living close to a military base where there are people trained to assist in natural disasters,2
i get home from work i log into wow and encounter my olc and feel thrilled depressed and when the encounter is abbreviated its just the depressed part,2
i still feel doubtful but i tell wally to go ahead and try it if he wants,3
i didnt and i wound up feeling bitter about myself call yourself a writer,1
i mainly volunteer online as i am usually unable to leave the house but i like to feel useful,2
i feel more determined to make it work she said,2
i feel aggravated that i dedicated a full post on him but this is on my mind and i need to get it out,1
i feel i m the singer when the show is over and also i am satisfied for my performance,2
i feel throwing away rotten vegetables is doubled when i realize they re being chucked because i ate bad foods instead of those nutritious veggies all week long,0
i started it not feeling triumphant and superior grinning down my nose at the cute first years but small and weak,2
i want to feel useful competent needed,2
ive got the day off tomorrow and i may feel like looking at this in a little more playful manner,2
i am feeling pretty peaceful and happy about the pending date may,2
i will feel it hurts when they criticize them or when they ask my most hated question is this evil,1
i was feeling shy at first as we entered their home since well be staying in a house owned by a strange family but then again its a new experience,3
i didnt feel angry toward the ex usually,1
i really think you could benefit from at least talking to someone and getting all of this anger and depression and guilt and general feelings of emotional ickiness off of your chest,0
i really feel insecure,3
i voted for president obama four years ago and i voted for him on tuesday so ill admit that im feeling pretty content right now,2
i never wanted to feel the pain i never asked love to tell me that it all has been in vain,0
i feel particularly pained by the way they acted as if that were just a waste,0
i feel slowly tortured by my own father,1
i want to hang out with monica but you never really know when she is going to be available so i feel obnoxious for calling her i tried to talk to himothy today and that was really stooooopid,1
i woke fo a little while ago and luckily im feeling perfectly fine today p so school start am or something and the clock is right now and im considering to go back to bed,2
i suspect youd feel outraged as i did this morning making a huge pot of cauliflour soup and imagining the waste fairy descending upon me,1
i feel like i should be more faithful to john because he is so good to me but then its not real so,2
i said not feeling too sure about it,2
i even feel myself responding to pleasant unpleasant stimuli in my environment attributing significance to those responses,2
i still cant help feeling you gotta be popular lah,2
i feel like this excuse is more a cop out disguising laziness i will not use this lame reasoning to withhold details of my experience on emei,0
i feel like me being distracted and forgetting whats important also involves me doing what is good for myself,1
i still enjoy it because i do not feel like i am being beaten over the head with a you are dumb and can t figure this out on your own stick,0
i really feel violent towards people who seem to think with their libidos instead of their brains,1
ive been with netapp for months now and was beginning to feel a bit dissatisfied with work,1
i think feels threatened by me if not definitely faced would have no problem bad mouthing me and investing effort to hate on me,3
i am going to give you a feel for what we did yesterday so you can feel how my back and legs are aching,0
ive missed preparing my posts and feeling excited about doing so,2
i has to bite back well and while we want to side with anna as the protagonist its hard not to feel bad for this man whos as much a victim of the social order as she is,0
i did not feel as though this stage was characterised by optimism as this was probably the most uncertain and trying time emotionally of the process due to my work situation,3
