text,labels
i don t necessarily want to feel that emotionally distraught i can handle that bit,3
a few days back,1
i have a right to feel so distraught,3
i am with my butt feeling kicked again and feeling crappy,0
i woke up feeling fabulous and im sure that half of that stems from the fact that ill be finishing my undergraduate studies in about weeks,2
i feel it was perfect as a jumping off point for what is to come,2
i feel annoyed that i feel to lousy to even do art or read,1
i feel that summer is the perfect time to spoil them rotten,2
im glad that at least he doesnt feel inhibited about expressing himself with me anyway,3
im feeling quite determined about,2
im feeling now you know im feeling fine,2
i feel really dirty and i stink so bad that even i can smell myself,0
i feel only a bitter plight,1
im still not feeling overly excited about it yet,2
i have not behaved myself in accordance with my principles and ive fallen behind on various things im doing on my own and in consequence i feel dissatisfied,1
waiting for the results of the high level examination i was afraid of not being accepted,3
i have been sick for a week and i am starting to feel better,2
i honestly feel that im a selfish person i dont want to think that i am but i feel that i am,1
i feel alone and like there is no one out there who could possibly understand where i m coming from half the time or have the sympathy and caring towards me and all that i have come through in life,0
i no longer feel carefree,2
i feel badly for his family how humiliated his wife must feel how embarrassed his kids must feel and for the son who now just found out who his father is and all the media attention it now brings upon him and likely heckling from school peers as well,0
i am not feeling stressed or broken and i for the most part am not feeling scared,1
i feel inspired and motivated every single day and can t wait to learn new skills make new contacts and push myself to be the best that i can be,2
i will have reached my personal goal of for movember but now i m feeling a little greedy for charity and want more,1
i feel that things are going well and we have a great rapport with each other,2
i feel paranoid sometimes,3
i dont want to lose my marriage but i feel as though being submissive to a man who dosent have his priorities straight and setting a poor example for my children is a recipe for disaster,0
korean judges cheating,1
i feel like i have been wronged,1
i remember that man and all i feel is cold and fear,1
i feel so insulted to be mistaken for a nanny,1
i began to feel a strange oneness with everyone and everything,3
i don t feel clever,2
i can speak english and not feel rude and everyone will clearly understand me,1
i can feel a little frantic but the fluorescent lights and the soothing white noise of cardio machines both wake me up and calm me down,3
i feel like everyone respected me for doing it on my own and looked down on my partner for not showing up,2
i hate feeling angry,1
i promise i wont be like those bitches posting that im feeling fine without you while i actually messed up,2
i feel simultaneously saddened and amused watching her rake leaves in a designer skirt and red rubber gloves,2
i will be feeling grumpy half of the day,1
i woke up this morning feeling groggy,0
i didnt add to this because i felt these were the major points and i still feel that way but my need to understand people pissed me off yet again,1
i was feeling soooo scared,3
i get the feeling that maxwell was determined to avoid any of the racial and class tensions between the slave owner relationship,2
i know why and i hate feeling helpless,3
i still feel annoyed,1
i feel wonderful but a bit unhappy,2
i chose a couch to k program knowing if i did it any other way id end up feeling annoyed with myself as i get back into running shape,1
i demand your attention your feelings and thought it rude to ask souper salad leave,1
i believe with all my heart that the place god has for me is just where i am a keeper at home and yet i was feeling dissatisfied and disgruntled all the time,1
i was feeling adventurous enough to go back out to rosaryville for what was supposed to be a mile run on a trail,2
i feel that bangs which do not cover the eyes should be accepted by the school,2
im feeling more energetic and forget that i need to put oil in my lamp before the darkness falls,2
i have been pushed into a corner and i feel insulted and so angry that it is keeping me up at night,1
i tell paul i m feeling the itch to do something artistic,2
i feel a little bitter,1
id like to offer some support to those of you feeling frustrated,1
i feel threatened by him,3
i feel heartless but its my chicken,1
i still feel wronged me,1
i would confront them even if the comment was not made directly towards me because everyone has feelings and just because the person may seem reluctant to speak up about it does not make it okay for someone else to make disgusting racist or homophobic remarks,3
i will eventually get over it but it sure does feel empty,0
im feeling hostile and possessive and inadequate,1
i feel another violent daydream coming up and i bet it has something to do with me getting my hands on a saint just costume,1
i would feel cranky but wow,1
i want to take a day off just to reply to really everything you commented because i feel it is so rude not to respond while some else took the time,1
i put it on private cuz i feel like ppl r gnna make rude jokes about me so only i can see it,1
i feel hated helping prevent gay teen suicide class digg title digg this,0
i requested some feedback on the old look and feel i was delighted by the amount of feedback that came back,2
i cant even count on myself to look the way i feel ugly,0
i am certain has happened to every parent at one time or another that they feel horrible or embarrased about,0
i feel like i m being tortured right now,3
i hate that i feel reluctant to actually post this because i don t want to deal with omg you re so pc and stop making such a big deal about it and well aren t you vain comments,3
i feel foolishly proud that i managed without incident,2
i beg for attention from traditional media which often feels pathetic demeaning the begging and futile,0
i must feel convinced that each candidate not only understands its significance but that in penitence and faith he is ready for the sacrament,2
i feel like a dumb ass that has been thinking with his dick,0
i began to feel alarmed and begged him to explain,3
i feel even more convinced that peace corps service isn t a self contained experience but a starting point for something bigger,2
i felt or feel disheartened for some words that guys say by my ex bf or by him,0
i simply feel pressured by myself to keep writing,3
i am oso feeling this way they r juz tooo greedy,1
i feel anxious and paranoid but the presence isn t allowing me to take my meds to calm down,3
i am so happy for her she has gone through a lot lately and desperately needs to feel the life pulse through her veins again and i dont want to be the one who takes that away from her because im being selfish,1
i am trying to be financially prudent but also not pay the money too much mind so as to enjoy my experience and not feel inhibited during this rare amazing adventure,3
i am starting to feel like maybe i do want a relationship im just to stubborn to admit it,1
i have a feeling that im going to become violent with certain people that i knew,1
i feel isolated and its like im asking a friend a favor if i need someone to talk to,0
ive always said its not how you feel its how you look but in this case being a cute corpse seemed to becoming more and more likely,2
i was feeling pretty chuffed that i wasnt a terrible mother after all and i just got on with enjoying the day,0
i haven t been home much to argue but i don t think that s the reason i m not feeling agitated by the stupidity of others as much,1
i understood then that my feelings match its unfortunate disposition,0
i cant help but feel like ive fucked this up somehow,1
i can see how others would feel annoyed by the flashbacks,1
i want to go out eat drink watch movies play and feel carefree,2
i am over analyzing every detail of my life which is making me feel like i fucked up somewhere along the way,1
i put feelers out in a casual search last may for an internship this spring sending out an inquiry to my top choice internship,2
im not sure whyit bothers me perhaps its from feeling ignored by my father for a majority of my life but that is a story for another time,0
id never admit this to her but hearing her talk about life with the girls that didnt include me kinda made me feel strange,3
i am feeling much better and thought i should get going on the blogging front,2
i had a memory vase where i encouraged people to write down silly or sentimental memories they had of times with l that she could read when she was feeling stressed in the weeks leading up to the wedding,1
i didn t like how it made me feel i was either really giggly or sleeping so i stopped taking them cold turkey without consulting my doctor and i freaked the fuck out,2
im feeling really insecure about my weight,3
i am so glad i listened rather than being angry or frustrated or feeling victimized by the unevenness of the garage floor,0
i look up from the photo and feel distraught at what i see,3
i had the distinct impression that frank john amp pete had discussed my bad behaviour and i was starting to feel paranoid,3
i thought the second pregnancy was suppose to feel faster because youre distracted with raising your first kid,1
i feel privileged to be his tour guide for his visit to roma,2
i wake up in the morning and feel overwhelmed,3
i feel like crap she makes me smile when all i want to do is be grumpy,1
i feel like a witch bc im aggravated and i want to go over there but like i dunno,1
i feel disgusted at myself for admiring you,1
im sorry that i find myself feeling a greedy anticipation as though im about to get something i like thats not good for me like an ice cream sundae,1
i remember being wheeled into surgery as the nurse whispered to me that i would start feeling a little groggy soon,0
im feeling very unsuccessful and overwhelmed at the moment,0
im back on the regiment and feel wonderful,2
i worked with kids for two years previously and i didnt feel shy at all with them,3
i feel anxious that makes it worse,3
i feel damn disgusted with myself now,1
i am feeling vicious,1
i feel excited about the future of a style text decoration underline color b href http www,2
i never expected that this is how i would feel i have never had a relationship that has been so carefree,2
i mean in the end i know it ll benefit me but i can t help but feel doubtful,3
i feel really determined to get out of my situation with bf,2
i like to feel but i am also scared of feelings i am definitely confused and figuring out my way,3
i understand that you may feel that it is very rude that i keep destroying your house with my face,1
i feel like i feel at mile of a mile race beyond suffering and resigned to bleak acceptance with the fading rational hope that it will end soon,0
i didnt feel like this would be an issue though i got nervous towards the end,3
i just feel like he annoys me soo much these days and if i were to talk to him id get really sarcastic then hed get irritated and say that im rude which will just make both of us madder,1
i do not feel submissive,0
im feeling very agitated and sad at times,3
i was thinking when i walked the few blocks from new york sports club to the conde nast building feeling fantastic after a morning workout,2
i still feel scared every time i go into a strange place,3
i feel as if the rawness may be less reader friendly but more accurate,2
im not feeling so anxious about other things happening this summer,3
i wanted to jump in and spend all feeling in my heart at that time but u know im embarrassed,0
i snap photos and feel disturbed that i m not helping,0
i am feeling a little discouraged about my items not selling,0
i didnt have any meltdowns but i did feel distressed,3
i feel low energy today i drove myself home after dropping my daughter off at school and i immediately sat down and wrote out a bunch of labels for some solid lotions,0
i am feeling very annoyed as i had to spend hours last night organising a stat dec and then tomorrow im off to sit in a vcat meeting,1
i have another confession while im feeling all vulnerable and transparent again,3
im struggling because i cant feel my feet all the time which makes me very unsure of where im walking,3
i don t want to suspend anastasia but i want to restrain her make her feel completely helpless so not only she surrenders her body to me but she learns to take possession of her own mind and consequently her own body controlling them both,3
i feel like a mouse among men perpetually terrified,3
i feel listening a mellow music rendered by christian bautista with title so its you,2
i think it s smart to look at these things early and ask ourselves what we want to continue to do the things that sustain us and make us feel like vital important and full of possibility,2
i feel like their greedy scum and i ll avoid their site at all costs,1
i had a feeling they would be very excited about trying these,2
i feel ferocious now,1
i sent the message feeling a bit nervous and very hopeful for a response,3
i coul oh i don t feel so the camera becomes shaky and we can hear the sound of terry vomiting,3
i dont actually think i could read the books without feeling disturbed and a lot more uncomfortable,0
im finding that just because i create a piece thats about a certain someone or event it does not necessarily mean that the feelings i have about them become resolved,2
i woke up feeling distraught,3
i feel dirty unclean unorganized,0
i feel very distracted when im not with her,1
im feeling quite lucky today,2
i am so excited to meet her honored i get to carry her feel so special each and every time she kicks,2
im assuming that will change one day and maybe i will want to celebrate being alive but for now i feel a little jaded about being expected to be so grateful when really this past year has sucked,0
i feel so privileged to have been selected by can fund to receive this support,2
i get on facebook when i m feeling low and having a bad day chances are it s just the moment when one of my friends is having a great day and decided to post about it,0
i think i was feeling somewhat restless because aisling did all the work for averys party so i felt the need to do something as well,3
i feel like we rushed through draft coverage of first rounder a href http valleyofthesuns,1
i feel about the messy html comments the ap automatically puts in,0
i feel resentment to those who dont ever workout and have perfect bodies,2
i wanted to feel so proud of myself for persevering through the changed plans yet i couldnt quite seem to handle it,2
i happily made my appointment and left mizu feeling fabulous,2
i understood that a feeling of melancholy could be a beautiful state in which to lose yourself but not to the extent of forgetting what happiness felt like,0
i am grateful to see the bigger picture that we are all beings of light moving through our lessons of life feeling suffering joy happiness pain grief excitement sorrow and more joy,0
i was feeling sad and trapped in my apartment i didnt really feel safe going out at night without a reliable way home and i got to the stage where i realised the only one who could help me was god you would think i would have figured this out faster than weeks turns out i was a little slow,0
i feel heartbroken and some of it was because of my own mistakes,0
im at a loss of what to blog about today feeling slightly overwhelmed by the fact that there is way too many things i could talk about,3
i feel very productive,2
i always regret it when i do because it makes me feel crappy during my run but i knew i wouldnt be home and showered until about which is nearly lunchtime for me,0
i felt awful feeling sorry for myself and told him i was sorry to hear about these folks,0
i got there she had been working on a bag that had some really bad instructions and was feeling frustrated,1
i am feeling a little nervous for the test,3
i feel selfish and then i feel guilty,1
i think women feel offended even now when there are tons more because they ve been taught offense is empowering,1
i feel like everythings uncertain and ive lost my way a little,3
i feel that he gets beaten up and somewhat manipulated and i can t do anything about it,0
i know that man plans and hashem laughs however right now i lack the stregnth and energy not to feel completely devastated by not graduating through no fault of my own,0
i shouldve said to kate today that i feel angry and hurt and that you betrayed my confidence i feel devastated and afraid and somehow i still feel fucking hopeful even though that tiny flame of hope makes me feel like an idiot,1
i feel like i m so uptight about things needing to follow these scripted rules about how i should lead my life,3
i feel rather selfish and spoiled for even using such a term but it is what it is,1
i don t like posting so soon after someone else does i feel like it is really really impolite somehow,1
i feel insulted by the people of texas,1
i feel happy but doesn t fix the problem of why i was upset question what does this say about ourselves and our culture,2
i enjoy eating so much have feelings and are being tortured all to be sacrificed at the altar of my dinner table,3
i have today and what im going through and feeling as uncomfortable and crazy as it is sometimes is so much better than i ever dreamed it could be,3
i changed from feeling abused to keeping my center,0
i feel that it is important to respect and value the role of literature in our society,2
i feel dumb spending hours in the game only to get worse,0
i dont know anything about aircraft and i feel i should be appalled by the whole display but im actually fascinated,1
i feel honoured to publish her thoughts on this years fall fashion on my humble blog,2
i feel it may still be a bit cold,1
i feel like i need to conform here in order to be accepted,2
i feel that he is pretty rich we waits bottoms go to that what ning joss stick the garden seek him to see,2
i feel oddly bouncy and yet sleeeppppy,2
i feel pressured i feel claustrophobic and i feel strange,3
i was feeling pretty smug at this moment when all of the sudden an angry voice breaks in i am holding a knife and i am looking for a place to put it,2
i could feel the water supporting me washing away bits and pieces of that perceived stress,2
i forget them i just want them feel weird why i work far from my hometown,3
i feel a little unsure of my decision but something needs to be done now before things get worse later,3
i pictured moving past all those things that held me in chains the feeling of being unsuccessful insufficient unworthy guilty faulty and flawed,0
i wipe the tears from my face i feel oh so very pathetic,0
i had it on in my car when i picked up my friend jamie for lunch and she so worriedly felt my forehead and asked if i was feeling ok,2
im feeling much more joyful about the waiting this go round,2
i did spend some time getting lost in what other people thought about me and what people expected me to feel that was horrible,0
i doubt that he have no feeling towards me as i am nobody and shy girl,3
once when i crossed the street,3
i feel resigned tonight i also feel strangely calm like calm waters before a storm perhaps,0
i do a lot of driving and luckily i have a good sense if i feel low even when i am just tipping below five,0
i feel it would be rude to correct them especially those who ve recently learned it,1
i wish i had brought that up it feels a little like a slap in the face when people cant be bothered to make sure there kids arrive close to on time,1
i can understand the strong reaction and feeling of innocent sikh brothers who became of victims of sudden eruption of people s violent hysteria,2
i feel like saying something sarcastic in response to this why else would she possibly want a word,1
i doesn t make you feel much of anything by the end you don t fear him like a terminator you don t think he s a badass like vader you aren t deeply frightened of him like an alien as a villain he doesn t really move you,3
i feel like i left by blog positively ignored and im very sorry,0
i feel burdened and my heart is riddled with guilt for not being able to honour my late mothers wishes,0
i have a habit of examining the ends of my hair with harsh scrutiny whenever i feel mentally and or emotionally and or creatively overwhelmed,3
i was coughing up a lung and feeling vile so i didnt,1
i feel really paranoid right now,3
i hate feeling lethargic and antsy all rolled into one,0
i remember glancing up at my mom amp she had tears in her eyes feeling helpless but she cheered me on,3
i feel very calm very focused very much in a good place,2
i know i feel the connection with my family friends and the world and i can now accept all these wonderful hugs people give me,2
i want to know her but i feel unwelcome,0
i have called this name thrice because listening to mourinhos justification on tv of the last minute dubious penalty kick awarded chelsea fc yesterday made me feel ashamed that this is a man without honour and no wonder he is the manager of chelsea,0
im to sit here feeling tortured for the next several hours while you sit there pretty as you please and have your merry way with my self control,3
i feel just as much as you do shinji mumbled not trusting himself to raise his voice in case he started getting mad again,2
i become so used to having a roommate that now without one i feel listless and prone to pointless reflection,0
i feel quite agitated that i know who is reading out there silently and giving the silent protest of whatever i m doing in a silent manner,3
i did feel like moore rushed through the novel,1
im feeling very doubtful now,3
im already feeling the moments why directors are bitchy especially on the indie films,1
i feel intimidated i guess,3
i definitely do not want this physical body to die anytime soon as i do feel pain and im not even assured if the copy of me will be the actual me,2
i feel honored youre seeing me and allowing me the gift of your reflection to remind me the power my inner light holds and the ability to recognize the positive difference my expressed authenticity makes on this planet,2
i likened the court proceedings to a very bad play and said he was feeling very discouraged and powerless,0
i was obsessively checking my phone and getting on the cycle of thinking about why i was angry and why i was right to feel angry,1
i have a feeling i m pretty boring,0
i end up feeling exhausted for all the rest of the day,0
i feel thoroughly fucked mr,1
i feel the messages of this book are vital for every woman to grasp,2
i awoke to a bright morning feeling apprehensive but excited for the day ahead,3
i feel tortured by my own brain,3
i feel personally offended when someone insults a musician that i like or embarrassed when someone makes fun of a song that is on my ipod,1
i feel as if i am losing control over my mind dont know if i can even become mad,1
i hate feeling like this insecure about myself,3
i think it is one feeling afraid of getting no comparable income,3
i am depressed or feeling hateful and lowly about myself i am entitled to be rude unsociable and not have to look at or talk to people,1
i don t feel the need to be rude,1
im feeling good and feeling confident that i can make it at least another day on this cleanse,2
i still feel you so near replaying the words editing my lines im so shaken with fear that no one could divine i couldnt speak those key phrases that could bring us to our knees all you need is to say please and my body is chaos adrenaline pangs to fight or flee,3
i feel like getting distracted i look at the clock and remind myself that its still writing time so keep working,1
im feeling adventurous ill choose one from chile or australia,2
i feel miserable,0
once in my work it happened a fight between the person in charge and me i got so angry and spoke out everything i felt at the moment,1
i think about the bloody scenes now i still feel disturbed,0
i feel that i get easily intimidated around new people,3
i have for those good things that i just listed feel significantly less than the feelings i have of impatience dissatisfaction discontent and unhappiness i have in my life right now,0
i feel like im in this weird in between stage,3
i feel so lonely in this world i regret it about everything i done,0
i zoom into those difficulties into feeling like having to give up everything and feeling more then helpless alone in a desert cast out by the ways voices and actions of others that is another story when i zoom into it i also temporarily loose the view of the full picture,3
i will always feel this way unsure,3
i feel that this technique is superior to others because it doe not require intense visualization which many,2
i dont have any real bad memories of growing up but i feel a strange sadness there too,3
i feel sad that he broke up with me for such petite arguments,0
i feel more and more anxious,3
i feel very satisfied at the end of our season when kids and parents thank our coaches for the positive experience we ve provided them,2
i suddenly had this overwhelming feeling that i was gonna look like an idiot and feel really unwelcome,0
i feel genuinely homesick for the place,0
ive been aware of new years resolutions and while the phrase new year new me has been a prominent phrase to express optimism in change i feel that recently it has become nothing more than the receiving end of sarcastic wit and often the phrase remembered alongside rolling eyes and sighs,1
