,text,labels
305,"Feeling anxious can be mixed up with other emotions too, and I'd like to see if you recognise any of the ones in this list, or if they seem familiar to you. Have you experienced any of the following emotions strongly before:",1
724,"Thank you for sharing this with me, I understand it can be difficult. Have you tried Protocol 6 recently and found it brought uncontrollable emotions stemming from past events back to life?",1
65,Was the thing that happened quite recent or did it occur a long time ago?,0
988,"Are you trying to help too much, perhaps, and feel that the person you're trying to help just won't listen to you?",0
779,"Okay thank you, I'm glad you're comfortable talking about this. Was this event that caused your anxiety recent or a while ago?",1
820,Do you feel as if you're always to blame when something goes wrong?,0
1011,"Thank you for confirming that you have taken this protocol, I hope it was a positive experience for you. May I ask if you are now feeling better or worse than before you started the protocol?",1
38,"Sorry to hear about your troubles, I am always here to help. Are you experiencing difficulties with any of your loved ones right now?",1
112,Was this recent or distant?,0
748,"I understand this event has been distressing to you. Have you revisited this event recently in an attempt to find closure in it, but all it has done is bring back the unbearable emotions you had during the event?",1
560,"Is there a power struggle involved, between you and one or more people in your life, where someone needs to win?",0
157,Would you say that you always blame and accuse yourself whenever something goes wrong?,0
149,Are you always angry at yourself when something bad happens?,0
769,That's unfortunate. Did anything in particular happen to make you feel this way?,0
909,Have you felt any of these emotions strongly toward someone:,0
581,"Ok, here are my suggestions. You can choose whichever protocol you feel would work best for you right now.",0
1020,Which one would you like to try?,0
693,"Thank you so much for your input. It sounds to me that you are feeling {} right now, does that sound accurate?",1
699,"It's completely normal to feel how you are feeling, I understand and I'd like to help. Do you think this was caused by anything specific?",1
101,"I have here a few protocols that I would like you to look at, I think that they may be able to help you. Please select the protocol that you would like to try:",1
267,"What event in your life do think has sparked this feeling, was it a recent one or more distant in the past?",0
624,Did this thing happen recently or is it something in the past?,0
26,"Now that the protocol is finished, do you feel any differently to how you felt beforehand?",0
22,"Have you recently tried Protocol 6, and if you have, did it bring up difficult emotions from past events?",0
689,Have you ever taken any advice or new perspective that was offered to you into practice in your own life?,0
364,"May I suggest a protocol to help enhance and maintain good feelings, it may really help?",0
463,"Do you think that somebody else is making you do something, or is hurting you in some way?",0
201,Thank you for sharing that. I've got some questions now to help understand your situation.,0
167,"Thank you for sharing this. Could you tell me if you see yourself as the victim, blaming someone else for how negative you feel?",1
610,"Have you had a personal issue with friends or loved ones lately, a falling out, perhaps, or have you had family issues?",0
877,"That's great, I'm glad you are willing to give this a try, hopefully you will find it very helpful. Please go through the protocol when you're ready and if you can press 'continue' once done, that would be great.",1
841,Do you reckon that thinking back to the event now could damage you?,0
959,I'm sorry that this protocol wasn't able to help you. Would you like to attempt another?,0
680,"Are you worried that you might take out these feelings of anger on someone, trying to control them perhaps?",1
178,"Knowing that your feelings are important to me, I need to ask you about your previous interactions with the protocols. Have you attempted Protocol 11 anytime recently, and if so did it spark difficult emotions for you remembering these events?",1
515,How do you feel after having taken this protocol?,0
967,"Thank you for sharing. Can you please tell me if this event that happened and caused your anxiety was in the recent or distant past? The more I understand, the more I can support you.",1
130,Are you experiencing any difficulties or are you facing a crisis in your personal life?,0
263,"Do you feel, perhaps, that the world is against you right now?",0
96,Have you felt any of the following about one or more people:,0
473,"That can sometimes happen, but there are more protocols here which might work better for you. Would you like to try another and see if it helps?",0
134,Did something in particular happen that made you feel sad?,0
587,"Did you notice if there were unbearable emotions that came up from attempting Protocol 6 (if you have attempted it), due to past events?",1
234,"Do you find that you always seem to blame yourself for the things that go wrong, even when you have no control over them?",0
231,"Please try to focus on yourself and the task while you go through this protocol. At the end, press the 'continue' button.",1
48,Could you tell me if this event or events happened recently or in the past?,0
765,"I'm sorry to hear that. Is there some recent event in particular that you could isolate as the cause for this, or is it an event that happened a while back?",1
500,Do you always blame yourself when something goes wrong?,0
553,Would you like to attempt another protocol instead?,0
401,I apologise sincerely. Could you please help me by selecting the option from the list that best matches how you're feeling?,1
78,"Thinking about it, would you say that you tend to always blame yourself when problems occur?",0
735,"Being loyal and helpful are always beautiful virtues to have, however, they can become unhealthy if we start to forget about our own wellbeing. Do you think it is more important to you to focus on helping others than growing and focusing on yourself?",1
402,"Thanks, I hope you feel better now but it's ok if you think you feel worse. How do you feel after taking this protocol? ",1
665,"Thinking about more or less recent situations, have you ever put yourself in someone else's shoes during a conversation?",0
874,Would you say you feel better or worse after taking the protocol?,0
357,"There's a variety of protocols we can try, I want to find the one that works best for you. Please go ahead and take a look, you can select whichever protocol you feel most comfortable with.",1
367,"Do you always take responsibility, even when it may not be your fault?",0
740,Would you like to try another protocol?,0
583,I can recommend some protocols that might help. Feel free to choose from these protocols the one you prefer.,0
776,Do you feel better now after following the protocol?,0
668,Let's talk again soon.,0
245,"Thank you. I know it isn't always easy, but anything you can tell me will help me to better understand your situation. Do you mind if I ask you a few more questions?",1
475,Are you frustrated right now with trying to control someone or something that you can't?,0
432,I will see you again soon.,0
606,See you later!,0
800,It is great to see you so positive today. May I recommend a protocol that is suitable for your current mood?,1
444,"Do you think that in order to feel better about yourself, you need to help other people?",0
626,Could it be that you are trying to save someone else here?,0
604,Do you feel a need to control others?,0
477,I'm sorry you're going through this right now. Did any particular event cause this? I hope there is something I can do to help.,1
927,Did anything happen in your personal life to cause these feelings?,0
946,Thank you for sharing. I'd like to ask you some questions so I can understand a bit more.,0
420,"I know this may be hard for you to discuss but your information has been very useful, thank you. Is it OK if I continue to ask you some more questions so I can get a clearer understanding of your situation?",1
657,May I ask if you always believe you are the main cause of your problems?,0
169,"Could it be that, sometimes, you attribute to others the responsibility for mistakes you make, or tend to shrug off guilt?",1
43,Did you happen to try Protocol 11 and do you think that may be why you are having these negative feelings?,1
579,Is this something that happened recently or a longer time ago?,0
106,Was it a recent or distant event?,0
15,"Did this happen a long time ago, or fairly recently?",0
135,Do you think it's possible that you're just trying to control every move another person makes?,0
255,"If you had a magic wand, are there people you would eliminate from your life right now, in order to feel better?",0
973,"Thanks so much for talking with me, I really hope it's done some good. I look forward to another session soon.",1
317,"Thanks, you were brilliant today. I hope I will see you soon, bye!",0
198,"In your own time, have a look at this protocol and try to complete it. You can press ""continue"" when you are finished.",1
1016,Has this protocol made you feel better or worse?,0
892,Do you think someone else's problem should be your problem to solve?,0
753,Do you always feel angry with yourself for the bad things that happen to you?,0
235,I see. Could you tell me if the cause of this anxiety is something that happened some time ago or if it happened in recently?,0
822,Could you tell me if this was something that happened recently or a while ago?,0
322,"I am sorry to hear that you feel worse. Do you feel like attempting another protocol, perhaps?",1
306,Has it helped you?,0
207,"Thank you for your response, that's helpful. Trying to look at yourself from the outside, do you feel that you are controlling or trying to control someone else's behaviour?",1
301,"Thank you. I get the impression you are feeling {}, am I right?",0
36,"Oh I am very glad to hear that! Feeling happy/content is something we all want to maintain, so may I recommend a therapeutic protocol you may use to enhance and maintain that positive feeling?",1
573,That's tough. Was that recent or did it happen a while ago? Either way your feelings are completely valid.,1
487,"Do you feel like you're currently experiencing intense personal difficulties, possibly with your loved ones or friends?",1
523,Thank you for your cooperation so far. May I ask if you feel obliged to rescue other people in your life from their own problems?,1
61,Do you feel you are being negatively affected by someone else?,0
186,Please try to look deeply into your relationships with others before answering the next question. Are you having any thoughts that you could be controlling someone else or trying to control them?,1
191,Do you feel that someone has done something to harm you in any way?,0
118,Thank you for answering that. Do you ever imagine what it would be like to have a viewpoint other than your own?,0
257,"While you are irritated, do you often find yourself trying to take control of other people?",0
519,Are you usually able to put yourself in the other person's shoes?,0
942,"I understand, thank you. Was this event recent or more distant?",0